according to smith (2008), there is a need for substantial and consistent support and encouragement for women to participate in studies.;;
the ostracism alarm comes in the form of feeling social pain, resulting in negative affect and threats to basic needs.;;
this may explain why in both studies we witnessed a significant indirect effect of ostracism on intrinsic motivation, controlling for pretest interest, through positive mood, but not through relatedness.;;
discourage large samples pointing to the complexity in data analysis that could end up compromising meaningful exploration of the collected data and lead to the failure of addressing research questions fully or worse still the researcher can fail to appropriately contextualise the data to the research.;;
the present research tests the hypothesis that, because of this unwillingness to regulate the self, excluded (relative to included or control) participants are more likely to exhibit the confirmation bias (fischer, greitemeyer, & frey, 2008).;;
that is, although everyone would benefit from the access to a public good, the individual costs exceed the individual benefits in producing them.;;
we believe that the tendency to underestimate the severity of social pain has numerous implications beyond school bullying.;;
furthermore, with pairwise cooperation there is the possibility that the same partners would recognize each other and meet repeatedly after they have built up trust (may 1987).;;
in this study we examined whether ostracism by a particular type of outgroup, a despised outgroup, was sufficient to inflict emotional distress.;;
the drops in performance we did observe among ostracized participants could be stronger with less interesting tasks; a more interesting task might serve as a more appealing means to recover from the ostracism experience than a boring task would.;
because each instance of qualitative research is perceived as a unique process requiring the researcher to craft his or her own method, flexibility, versatility, and creativity have been emphasised, and methodological ambiguity tolerated as an inescapable, even desirable, component of the process.;;
if a young person in a school setting feels they do not have a clear understanding of the research project, the stigma attached to declaring this status might cause the student to hesitate to tell the researcher so (gallagher et al., 2010).;;
additionally, we took guidance from interpretive description as we sought to meet potential consumers of our research where they were figuratively and literally to broaden the research audience and uphold the motivation for conducting applied research.;;
when making attributions to prejudice, both the source of the prejudice (external) and the target's group membership (internal) are necessary but not suffi cient causes of the prejudice treatment (mcclure, 1998).;;
moreover, might socially included and excluded individuals simply differ in their interest in mating, as documented here, or do they also prefer different strategies toward mating based on the amount of resources they have available to invest in the first place?;;
this held true even though expectations of reciprocity and overall confidence in one's own ability to influence outcomes were low in the large group collective condition.;;
the apparent failure of the withdrawal function to impair communications can be explained in that the subjects simply did not use the no-play option as an instrument for withdrawal, thus preventing a meaningful analysis of any potential withdrawal function.;;
they exercise influence indirectly, through city council members whom they repay with opportunities to win voters' favor.;;
this research suggests that a public good contribution can be a self presentation strategy and that the benefits of these contributions to society are sometimes of secondary importance.;;
when the target has not met this need in a group setting, s/he can fulfil it elsewhere, for example, by helping a fellow undergraduate (in 41 group) outside the group context.;;
conversely, when unstable self-esteem individuals experienced a negative daily event, it made them feel bad about themselves and also, lowered their self-esteem.;;
these data fully support our main hypothesis, and show not only that self affirmation can facilitate non-defensive processing among unrealistic optimists but that its absence in the face of threat can foster such defensive processing.;;
as such, our findings cannot finally clarify who does contribute to intergroup conflict although they do clarify that prosocial individuals are not the evildoers.;;
human errors are a natural by-product of science as a human enterprise and need to be expected, but the current system is not designed to detect, embrace, or correct mistakes.;;
the cluster analysis results suggest that the built environment is the outcome of mode of governance producing places and contradictions.;;
reflexivity lends itself well to utilization of intersectional approaches in qualitative health research as both approaches are rooted in the injunctive to challenge upward categories of oppression (pillow, 2003).;;
the notion that habits become routines and that routines become legitimated knowledge is an essential component of a socially constructed reality.;;
williams (2001) found that ostracism causes a rapid decrease in the satisfaction of belonging, self-esteem, control, and meaningful existence.;;
ostracism is experienced neurologically as pain (eisenberger, lieberman, & williams, 2003), and hurts even when being ostracized by a hated outgroup (gonsalkorale & williams, 2007).;;
this closeness of the researcher to the object of the study is argued to be a unique feature of qualitative data, so it is challenging for the researcher as a 'positioned subject' (rosaldo 1993, 7) to consciously reflect about his/her own acts and background in relation to the data.;;
she noted that children who lived in well-resourced communities benefitted from private educational programs, whereas children in underresourced communities were left to struggle on their own, as she did as a child.;;
these measures widen significantly the range of compromise solutions available to both researchers and interviewees.;;
"ethnographers might become an advocate when they become ""aware of an issue"" through their research or when they become ""more deeply committed to the issue"" (p.151) through their research.";;
similarly, hall (2004) reveals how in previous writing he has removed accounts of personal reflexivity, or relegated these accounts to forewords and afterwords rather than including them in the main body of the text, due to concerns about the ' appropriateness ' of such material in an academic publication.;;
the sheer diversity of data types creates challenges for engaging in open science as few repositories have the capacity to store or share all possible forms of representations that constitute the datasets of qualitative researchers.;;
while some equilibria complete the project in the dynamic game with a completion benefit, there is a unique zero-provision equilibrium in the two static treatments as well as in the dynamic treatment without a completion benefit.;;
although we also argue that ostracized participants seek connection, our mediation findings suggest that our ostracized participants are attempting to connect with their rejecters when given the opportunity.;;
in addition, bettez's noted 'being critically reflexive is especially important so that researchers are more aware .;;
to the extent that commodity firms may be more likely have multiple facilities while final good firms may be less likely, these variables may be proxying for differences in the organizational structure of these types of firms rather than capturing pressure from consumers to be more environmentally friendly.;;
if this is not possible a range of alternate options might find satisfactory ethical bounds, such as writing the account as fiction, or disguising the others extensively.;;
results of attribution might have been moderated by targets' locus of control, and any non-significant effect may be due to this distinction.;;
the establishment of solid foods 2022, 11, 2287 3 of 18 methodological guidelines can be extremely useful when analysing qualitative data, as it has been criticised for its rather subjective nature for a long time.;;
a study by isen and reeve (2005) found that people in a positive mood found enjoyable tasks to be more intrinsically motivating than participants in a neutral mood.;;
scodel, minas, ratoosh, and lipetz ( 1959) and minas, scodel, marlowe, and rawson ( 1960), among others, have shown that the level of cooperative responses in repeated prisoner dilemma games is low and decreasingly lower for later trials.;;
"this framing is consistent with the general belief that qualitative methods excel at providing explanation and description but are weaker in documenting causation or allowing for future prediction (e.g., creswell & creswell, 2017; luker, 2008; mertens, 2014).";;
training a camera on the spatial articulation of healthcare facilities or on objects and interactions which constitute particular treatments or interventions can emphasise what had hitherto remained unnoticed and make visible some of the affective and social complexity of our engagements with health services.;;
"however, it has also been argued that, to the degree the group membership is central to one's identity, the attributions to the group membership are not helpful because the self is still centrally implicated (branscombe et al., 1999; major et al., 2003; schmitt & branscombe, 2002a).";;
counter intuitively participants who experienced romantic pain reported better past love lives (experiment 1); participants who experienced social rejection reported better past social lives (experiment 2); and participants who received disappointing grades reported better past academic lives (experiment 3).
obviously we cannot hold em constant at 0.50 since em is now a function of a probability that varies with the number of total contributions to the group account, but this parameter iz ation yields emˆ0.50 when exactly half of all tokens (37.5) are contributed towards the group account.;;
results based on previous research, i predicted that experiencing ostracism would lead to decreases in psychological well-being and self-control.;;
for example, in a study conducted within a particular community or organization, particular relationships or shared experiences involving a number of participants may suggest that the accounts of these particular individuals will evoke similar concepts.;;
we used taped rather than written affirmations because we were using a community sample for which written essays could be burdensome.;;
the trustworthiness of preexisting data is often questioned by opponents of the method, perhaps because the reliability and validity cannot be addressed in the same manner as quantitative data (shenton, 2004).;;
involvement of these gate-keepers may result in sampling biases or limit study respondents' candour.;;
provided that individuals have preferences for supporting the public good besley and ghatak (2007) and kotchen (2006) show that theoretically public good provision through markets can exist in equilibrium.;;
second, the effect of this social observation may shed light on the reason for possible gender differences in strategic behavior.;;
as pe increases, targets feel more threats to their needs and put less effort into group tasks.;;
in thinking about my role as researcher in this experience, and the power dynamic between the teachers and myself, this experience will shape future member checking interviews.;;
the other advantage was that during the design phase the researchers' understanding of the concepts and the ideas improved a lot compared to the initial interviews during the requirements analysis.;;
they believed that strict guidelines and processes are required to protect the quality and reporting of the research and the reputation of the researcher(s) and their institution(s).;;
if you do not buy a marker in the example above, your markerpayoff will equal the grouprevenue of 140 cents, because you do not incur costs.;;
it is clear that to induce cooperation in a repeated prisoner's dilemma game, one of the parties has to `break the ice' and choose to cooperate.;;
thus, rather than give up on the notion of objectivity, it is better to promote an understanding of objectivity which may serve as a reachable-and useful-guiding ideal in qualitative research.;;
"knott, e. (2019), ""beyond the field: ethics after fieldwork in politically dynamic contexts"", perspectives on politics, vol.";;
individuals with traits more characteristic of cluster a pds may find social interaction so aversive that being removed from such an interaction may provide relief.;;
"bad things are being said about me behind my back"", freeman et al., 2005) or whether it enhances psychotic paranoia (delusional thoughts, withdrawal, avoidance).";;
supportive and happy faces during the game, or have a social support condition, to mediate the effects of social rejection.;;
as with leaks from whistleblowers, ati/foi disclosures frequently move us in unexpected ways, invoking emotional responses but also the desire to act politically (also see heuristic and political significance below).;;
when committed by coethnics, wage-cutting is sympathetically described as compelled by poverty.;;
similarly, research supervisors of postgraduate (especially doc­ toral) students could likewise challenge the use of verbatim quotes as research titles via discussion debate within supervisory sessions tutorials (especially with those who may be tempted to use such devices).;;
this ensured that participants would at least get a decent base payment for participation independent of their earnings in the experimental game.;;
consistent with our finding, leary, haupt, strausser, and chokel (1998) reported that trait self-esteem did not moderate participants' reactions to interpersonal rejection.;;
furthermore, inquiring about our participants' motivations to volunteer for our study suggests that researchers may gain further guidance in identifying appropriate recruitment strategies by considering a negrin et al.;;
this is consistent with the theoretical framework proposed by smart richman and leary (2009), indicating that when targets perceive ostracism as unfair, they are more likely to engage in antisocial behaviours.;;
these results indicate that the exclusion situation mainly influenced the 'other-focused' negative emotional state (contempt, resentment, anger) in patients with bpd.;;
study 3 showed that ostracized participants primed with destiny beliefs, compared to ostracized participants primed with growth beliefs, gave less positive evaluations to an unknown job candidate.;;
"first, participants in the lab are not likely to be close and communal with relative strangers (whereas they might respond communally automatically to other close partners; see häfner & ijzerman, 2011).";;
"the way saturation is defined influences the time and context of when and how it can be achieved (guest et al., 2017; saunders et al., 2018; sim et al., 2018).";;
this shift in selfesteem prompts behavior that is likely to maintain social connections.;;
grange and lian 5 illustrating home participants living alone during the pandemic repeatedly linked spending more time at home to exacerbated eating disorder symptoms, including increased body checking (looking in the mirror, pinching parts of the body), calorie counting, bingeing, and self-induced vomiting.;;
although none of the rituals we investigated can be counted as rarely performed (all were performed at least one per month), our findings nevertheless suggest that frequency may somewhat impair ritual's power for supporting cooperative behaviors revealed prosociality.;;
the nature of the relationship among exclusion, belongingness, and mimicry suggests that individuals may be able to establish themselves in desired groups by mimicking the behaviors of group members and to reestablish themselves in groups from which they have been excluded by mimicking representative group members.;;
"a posthumanist ethics therefore shifts the focus away from the power of researchers over research participants toward the ""world-making"" powers of practices of inquiry: their ability to constitute the very nature of their objects subjects of study.";;
while the process can be employed with teams of various sizes, we have found teams of two to four analysts to be most effective because they capitalize on the integration of multiple perspectives, while also limiting variability due to inconsistencies in coding (olson et al., 2016).;;
such differences can be particularly important for high risk projects, which require a high reliability of findings (see section 3).;;
findings - using multi-method and creative approaches can facilitate young children to assent and dissent from service evaluation in a school setting.;;
similarly, i expect that prosocial participants will evaluate others' high contribution as more fair.;;
not only are funder demands reconfiguring researchers' expectations about their data but also open data tends to be treated as an inherent good within the research community.;;
the groups versus individuals by assessment order interact indicates that the tendency of individuals to expect more cooperation t groups was more apparent with the after assessment.;;
furthermore, in making use of the film to instigate a co-design process, ebcd arguably takes the participatory principles further than some photovoice projects by moving beyond priority setting to engage patients as actors in a collaborative shaping of service improvement interventions.;;
because social exclusion leads to an enhanced search for preference consistent information while neglecting preference inconsistent information, potential risks may be overlooked.;;
one was that the extent of recovery would be greater for those who attributed the ostracism to a self-possessed (and permanent) group membership due to making external attributions (e.g.;;
complementary estimates (available upon request) in which we interact police with received points in t-1 show that being a police subject has no effect on negative reciprocity.;;
for instance, it is hard for targets to come up with attributions over an on-line ball tossing game, as there is little information to make the inference.;;
when human uniqueness attributes are denied to people they are explicitly or implicitly likened to animals, and seen as childlike, immature, coarse, irrational, or backward.;;
there are ethical implications of not exploring the degrees to which the transcripts themselves are creatures - born of decisions, of available resources, of researchers' own assumptions and understandings.;;
this added complexity in the problem faced by critical third players is, oddly, a positive feature of using three rather than two players.;;
but our procedure could have created a deceptive feeling for some subjects who believed that the experiment would end after 10 periods.;;
subjects make costly decisions that yield signals to others that are specifically targeted in relation to current round decisions.;;
on the other hand, the extent of a researcher's knowledge of analytical procedures will have an influence on and be revealed in different forms and approaches to analysis.;;
"this approach diminishes the active role of individuals in creating, maintaining and interpreting their networks and relationships, as well as the situational, contextual, and historical aspects of agency (hollstein & pfeffer, 2010; hollstein & straus, 2006).";;
when including close personal contacts, researchers are likely to have more personal background information on their participant, and it is important to recognize this dynamic and how it can impact specific questions.;;
"in contrast, growth theorists often attribute frustrating experiences to controllable factors (hong et al., 1999; knee et al., 2003).";;
"grant et al., 2016 observer triangulation using an outside coder to develop ecomaps led to ""observer triangulation,"" a strategy to enhance rigor and limit bias.";;
any experienced pain of not belonging that was specific to being ostracized was not enough to motivate ostracized individuals toward steps to increase belonging in either traditional or virtual social networking programs.;;
this underlines the need for effective prevention programs for persons at higher risk (bechdolf et al., 2005) that promote coping with stress and thereby prevent the onset of psychosis.;;
optimism is also linked with greater self-esteem (wu, tsai, & chen, 2009).;;
also, resampling the data overcomes the problem of nonnormal distribution, yielding more accurate parameter estimates, which further reduces possible type i errors (preacher & hayes, 2008).;;
individual characteristics do not change the reactions to and results of full ostracism, but they do appear to change reactions to and outcomes of partial ostracism (chen & williams, 2007).;;
it may be hard to ascertain whether participation is voluntary because of power and reciprocity: some of the elderly were introduced by the residents' committee.;;
for instance, schneider and turkat (1975) reported that low self-esteem individuals were more dependent on the evaluations of others in determining their sense of self-worth.;;
a in group 12, although the contribution ratio does not change, cooperation collapses with all contributing 0 after period 14 (and except period 16).;;
however, by doing so, it may occlude how normative expectations about what 'patient experience' is may continue to structure the production and the consumption of narratives through these visual recordings.;;
ecomaps may provide an opportunity to understand patients' social support and contextual factors allowing better understanding of disease.;;
today, almost two decades after solomos and wrench described how western european countries were grappling with the social integration of immigrants in the 1980s, concerns over tensions between immigrants and host majority populations have only become more prominent in europe.;;
thus, the amount to be gained through a cooperative invest choice was not much larger than one's initial endowment, and one would be tempted simply to keep one's endowment (i.e., defect) rather than risk losing it in the hope of obtaining a relatively small gain.;;
these studies might end up with heterogeneous samples due to the fact that funding institutions would prefer a more comprehensive overview of the research problem, one that includes as many stakeholders or fields as possible.;;
not everyone is a cooperator, though: some people are predisposed to cooperate, even at a cost, as long as they expect their group members to cooperate as well.;;
as one might expect, experiencing social exclusion may very well engender a fair amount of negative mood in general and possibly sadness in particular.;;
after participants had received bogus feedback about the harvesting decisions of a specific group member (i.e., 150 harvester vs. 100 harvester), they were asked to what extent they blamed this group member for the overuse.;;
we predicted that strong (vs. weak) destiny beliefs would interact with ostracism to produce the highest levels of aggressive affect.;;
the fi nding that dyads were indistinguishable from larger groups is consistent with the view that dyads are groups, at least in terms of their behavior in these mixed motive interactions.;;
here, we investigate whether proclivity to empathize or systemize has any bearing on the perception and experience of social rejection.;;
"the contractual, quasi-legal procedures required by ethical review boards are, according to some scholars, entirely in commensurable with the relational, emergent"" (sabati, 2019, p. 1056) nature of qualitative research, in which it is impossible to fully inform prospective participants about the nature of participation.";;
"single episodes of victimization that might seem harmless for teachers and for other students, would activate the cognitive affective network in the victim who perceives the ""minor incidence"" more negatively.";;
hence, a culture of installing rules, monitoring, and sanctioning people's behavior may, in the long run, evoke an extrinsic motivation to cooperate and may induce people to search for ways in which the rules allow them to pursue their self-interest (see also prendergast, 1999).;;
engaging the concept of care with the concept of informed consent allows me to account for consent practices as an affectively charged and non-idealized engagement, and to approach ambiguous and creative aspects of research engagement with curious attentiveness.;;
initial analyses indicated that ostracized participants showed higher motivation for obtaining snack food during an operant computer task than participants who were in the included control condition, although there were no cyberball condition differences in actual food intake.;;
since most field settings involve subjects with a higher opportunity cost of time and less formal education and literacy, researchers have often used different instructions in the field than in the lab.;;
the study in a gc will increase the probability that underpinning ntss will hold true, except where the data are used to contest a nts.;;
there was a perception from researchers that ethical processes were not keeping pace with technology - a sense that research progress was being hampered because researchers were not being allowed to maximise the tools available to them, at the speed they were required.;;
