the approach enables the researchers to 'stand alongside' rather than 'gaze upon' the subject - thereby actively acknowledging both the participant and researcher in the co-production of the narrative (edwards and weller, 2012).;;
deciding whether a comment is meaningful but not useful will therefore depend on the research questions being answered and the particular survey instrument.;;
result 4: in the ppg and pps treatments, the further below the group's average a subject contributed, the more first-order punishment the subject received.;;
moreover, participants who could not double their payoffs were more willing to retaliate than participants who were under constant threat of losing all their payoffs.;;
moreover, the fact that financial incentives moderated immediate responses to overinclusion but not to ostracism suggests that individuals process information differently in these situations.;;
that is, it is unclear from the research whether overconfidence takes a constant force of will or whether it happens relatively automatically for most people.;;
discussion using a mediation approach, study 3 showed that social exclusion leads consumers to want more money as a means to secure control in life, which in turn fosters riskier but potentially more lucrative financial decisions.;;
fragmented work settings make it challenging to employ the method that is intended to narrow the gap between what people say and what they do.;;
by showing that interpersonal rejection leads consumers to pursue riskier financial opportunities, our research uncovers a shift in consumers' idiosyncratic risk-to-benefit ratio as a result of social exclusion.;;
the emphasis on checking credibility ensures that interpretations are grounded within the data.;;
thus, whereas participants discuss in interviews challenging experiences similar to those they share in these other venues, the photographs offer an opportunity to think about and reflect on these experiences in new ways.;;
for example, people may intend to use public transport to go to work but the schedule of public transport does not fit well with their working schedule (e.g., there is only one bus per hour on a particular line).;;
despite the interpreter's influence and the potential obscuring of the aim and intent of the interview, interrogation of the interview and follow-up translation has helped to recalibrate the analysis.;;
this was intended to mitigate any potential bias or confounding factors during the answering of questions since the lead researcher was a co-worker to the study respondents.;;
players hoping to get a larger share of the resource may fancy that a smaller group size (a desirable outcome) is more likely than a larger group size (a less desirable outcome).;;
different researchers providing differing analyses may provide the insight, engagement, and nuance that is necessary to better understand a particular social science phenomenon.;;
in particular, if the indicator for the previous round, vijt−1, is incorporated into the expenditure or level equation, then under the null of no selection effect, its estimated coefficient will be insignificant under a standard t-test.;;
without perpetuating assumptions constructing truth of and about a unitary and absolute self based on judeo-christian foundationalism or modernist secular humanism, the first-person perspective has the capacity to view self in relation as multiplicative and multivocal (valverde, 2004).;;
moreover, the effect of social exclusion on the confirmation bias was not due to differences in reported mood.;;
ilardi, leone, kasser, and ryan (1993) found perceptions of relatedness at work to be positively related to job satisfaction and personal well-being for employees.;;
if joseph believes that most others are contributing (i.e., high normative expectations), then it would be rational, from a purely self-interested perspective, to free ride and not cooperate with the group.;;
third, ostracized individuals feel they have less control over social interactions (williams & sommer, 1997).;;
results also show that the words oppressive and monuments associate with rulers' desires to commemorate themselves as immortals and imply to the public they are in charge.;;
observers should be sensitive to the size of the costs that people incur in contributing to the group fund.;;
ultimately, a number of individual differences may moderate the speed at which participants are affected by ostracism, how quickly affect levels may bottom out, and potentially the speed of recovery.;;
thus, extrapolating from the findings of molden and colleagues, they may be inclined to seek reengagement, which might also lead them to behave relatively prosocially.;;
it is readily apparent from figure 1 that the strength of reciprocity, as reflected in the slope of work expenditures with respect to wages between $0 and $3.50, increases greatly among primed jews relative to unprimed jews.;;
it may be that the findings of the current study are an accurate reflection of self-esteem levels after ostracized or it may be that my findings were confounded by reasons mentioned previously.;;
when working in volatile, dangerous, and unfamiliar settings, they rely heavily on fixers, ras, and other local staff.;;
participants are quite likely not to change how much they contribute at all, and if they make a change, the new amount is close to the previous amount.;;
qualitative inquiry requires researchers and evaluators to know credibility techniques well enough so that they can apply and blend them so as to help justify their findings.;;
given limitations on data, this tends to be the weakest of the four approaches.;;
emerging from earlier emancipatory discourses, conceptions of silence or absence were a punitive effect of domination and penalty.;;
this example of an icr-amenable coding strategy illustrates how the conditions necessary for icr assessment can constrain coding practices.;;
an additional important finding of fehr and g¨achter is that punishment is more heavy the more free-riders deviate from their group's average contribution.;;
in two experiments, self-control depletion was manipulated by having participants either resist tempting cookies or by inhibiting thoughts about a white bear.;;
williams / journal of experimental social psychology 48 (2012) 829-837 ethnic outgroup members is likely to result in more hostility than exclusion by ethnic ingroup members, exclusion by ethnic ingroup members is likely to result in stronger fundamentalist religious beliefs.;;
thus, this would intensify interpersonal stress with their family members and increase the risk of relapse.;;
"they may be badly drawn, painful to think, costly in the exchange of certainty, but they assure creativity, transform the dead tissue of thought, and allow openness"" (dewsbury, 2003, p. 1912).";;
e-mail: deb on oae ws su edu doi: 10 1111 j asp 12013 abstract we propose that egotism about one's abilities may be related to good self-regulation and a lack of self-control may reduce estimations of aptitudes self control depletion should lead to more accurate and therefore less lofty predictions of future performances.;;
b (2003) 270, 2279-2283 2279 ó 2003 the royal society doi 10 1098 rs pb 2003 2491 cal and empirical work might be bridged is by making models more realistic, and one way to do this is to allow for varying investment in cooperation.;;
from the perspective of equity theory our treatment manipulation can be considered as fair if effort subjects earn more than the windfall subjects.;;
it was predicted that neurotic is m linked differences in appraisal would be obtained when ostracism is ambiguous.;;
preliminary studies suggest this to be the case due to the effect of individual characteristics;;
interestingly, these correlations were observed only in conditions i and iii, both of which require loss sensitivity to process the circumstances to maximize one's profit.;;
the overweighing of the largest outcome makes the gamble more attractive.;;
based on my findings with the tracing task, it appears that ostracism affects the ability to persist at a difficult task, but not the ability to initiate the task.;;
in qualitative research the depth, breadth and meaning of the data elicited from participants is of greater significance than the size of the sample (patton, 2002).;;
discussion study 1 showed that reflexive responses to ostra­ cism are moderated by whether the game is depicted as a ball toss or bomb toss.;;
qualitative researchers often refrain from disclosing such data in their own studies, and so such information might be standardly redacted, removed, or otherwise edited out of shared data.;;
not only could this increase overall cooperation, but it could in particular facilitate cooperation in the contexts that rely on rational, deliberative decision making;;
without overtly criticising the answer of p1 the new question by p4 increases the pressure on her suggestion.;;
the consequence for evaluation is that it must involve negotiation among stakeholders so that the basis of their understandings and values is part of the process.;;
if a deviation to d after h∗ r0 does not pay for type si and the prior psi is sufficiently close to 0.5, our calculations above imply thatsi + 1 must react to this by playing c in at least two of the following rounds.;;
this result is surprising, as one might have expected the indirect reciprocity induced by this matching procedure to weaken rather than strengthen trustworthiness 20 overall, this exercise leads to mixed conclusions.;;
high obligations seem to be a good tool to induce high cooperation levels in one-shot situations or in the earlier periods of repeated games.;;
e) communication among experimental subjects strongly increases the contributive rates (ledyard 1995).;;
we hypothesized that social exclusion of blacks by whites would be attributed to racial discrimination and associated with greater substance use vulnerability among those who do not affirm their ri.;;
in contrast, we predict that for long-term ostracism, targets will internalize the threatened needs, resulting in feelings of depression, alienation, helplessness, and worthlessness.;;
the brokers stepping away from their interview responsibilities forced us to explore other interpreter options, giving us insight into benefits that other hiring practices offer.;;
this kind of focus makes our discussion distinctive in exploring those micro dialogues we have with ourselves in the life of a research project and thus extends important methodological discussions within the social sciences.;;
indeed, minimal group members demonstrated in-group favoritism when engaging in a simultaneous prisoner's fig.;;
"we call this function of curation ""enabling epistemically responsible reuse,"" and define epistemically responsible reuse (err) as secondary use of data that actively aims to understand as much of the original data and context as possible and does not make claims beyond what can be justifiably inferred from the data.";;
adding injury to insult: unexpected rejection leads to more aggressive responses.;;
teti noted instances where the use of digital images in contemporary society might lead to poor outcomes.;;
however, we do see sizable opportunity for naturalistic, inductive qualitative inquiry to have a broader impact in the field of public management if we start from the perspective that both qualitative and quantitative methods are compatible and complementary buckets of tools within social science.;;
"indeed, several studies find that recognizing contributors by revealing their identities increases contributions to public goods (andreoni and petrie 2004; rege and telle 2004; soetevent 2005).";;
in group excluded participants who interacted with an ingroup confederate were expected to mimic the confederate's foot-moving behavior more than other participants.;;
at its simplest, this means that the greater the consistency between the findings from the interpretive and quantitative analyses, the greater the trustworthiness of the findings - therefore, the more grounded are the findings in the source data.;;
the need to belong is so fundamental that emotions provide feedback to inform people that change is needed in order to restore social connections (dewall, baumeister, & vohs, 2008).;;
nevertheless, our primary aim was to determine whether compliance increased after ostracism, which it did, regardless of the compliance technique used.;;
as people learn to balance cooperation and exploitation early in life (eisenberg & strayer, 1987), these proposition behavior associations are likely to be well rehearsed and to fire outside of conscious awareness (for similar arguments, see bargh et al., 1996).;;
in contrast, theories in the interpretive paradigm assume that reality is (at least partly) subjective, focus upon uncovering the meaning actors give to events and are well suited to qualitative research methods such as participant observation.;;
in addition to the desire to maximize raf¯e tickets for themselves, they should also want to maximize raf¯e tickets for her.;;
researchers must weigh the risk of the participant's right to be informed about their health status against the probability that the participant will develop the disease before, causing undue distress by informing the participant of their potential risk.;;
surprisingly, leaders emerge most strongly when they can voluntarily report their contribution to the rest of the group.;;
instead, depleted participants were more modest in their predictions and more accurate in their predictions than nondepleted participants.;;
the way in which players perceive the nature of the situation - especially the stable and generalized differences in how they characterize the situation - plays a pivotal role in the processes underlying pro-social behavior.;;
however, their design did not allow them to examine how introducing cash into the experiments affects subjects' behaviors, compared to those in a point or token environment.;;
reciprocate patterns were used twice as often by aggressive couples than non-aggressive couples and may be a useful pattern in distinguishing the two groups.;;
this benefit, however, can only be reaped when the standard applies to the target of judgment - that is, within the same domain.;;
"however, women seem to be more vulnerable to social triggers of health disturbances (denton et al., 2004; troisi, 2001).";;
to address this issue, it would be useful for research adopting a more participatory approach to explore confidentiality with children and provide examples of concerns that would need to be shared to keep them safe.;;
first, prior work has shown them to differ on their perceived severity as well as to result in different outcomes for at least one dependent variable (i.e., physical pain sensitivity, see bernstein & claypool, 2012).;;
first, individuals must differ, whether in resources or strategy (kurzban & houser, 2005), such that some individuals would make better partners than others.;;
as fehr (2009) points out, it is difficult to maintain that trust is exclusively one or the other.;;
the signaling effect is likely to affect both participation and the average donation size positively (andreoni 2006; vesterlund 2003).;
and even when a person-centered care approach is deliberately applied, some patients' stories are taken more seriously than others [29].;;
the design we used was based on the assumption that experiencing a small dose of the specific pain produced by an interrogation tactic provides a more realistic and complete understanding of how that tactic is experienced.;;
it is also consistent with williams's (2009) temporal need-threat model, which argues that participants strive to resolve or cope with threatened fundamental needs after the experience of ostracism.;;
this may lead individuals to be less likely to aggress publicly, for fear of appearing socially undesirable.;;
thus, in concert with previous research (baumeister, twenge, & nuss, 2002) showing that social exclusion leads to impaired logical reasoning, the present research suggests that excluding individual decision makers might lower decision quality.;;
we hypothesized that ot, compared to placebo, would increase button-pressing rates at the end of the game, and that this effect would differ according to inclusionary status in the game.;;
another less extreme example of ostracism is that only some of your group members may avoid you and not interact with you while others act normally toward you.;;
the symmetric pareto outcome is attained by the aam under bewds.9 under the aam, however, the player who chooses a smaller number must contribute more.;;
the price for the right to play the game served as an efficiency enhancing coordination device if the price was high enough to exclude inefficient equilibria.;;
perceiving discrimination against one's gender group has different implications for well-being in women and men.;;
having a friend or mentor makes the work environment more pleasant for someone who is ostracized.;;
by contrast, in a sh, a non-best response can involve play of both x and y, depending on beliefs.;;
snowball sampling also acts as a source of internal validation from within the participant group as by recommending other participants this can be seen as a source of approval of the research and potentially also the researcher (browne, 2005).;;
consistent with this, individualists were indifferent in their second choice since all the remaining alternatives provided them with the same outcome.;;
moreover, advancing qualitative research that aligns with the complex experiences of caring for individuals with dementia is central to optimizing caregiver support in the community.;;
"williams & bargh, 2008), but priming interpersonal interaction should not affect experience with coldness (bargh, 2006; lakoff & johnson, 1980).";;
others will argue that covert observation and data collection is unethical in almost any social media context.;;
when these high cooperation rates had stabilized, contribution rates to a sanctioning system disappeared.;;
for example, although the effect of ostracism should be attenuated when it can be attributed to external causes (williams, 2001), individuals who can blame the social exclusion on computer malfunction are still adversely affected (eisenberger et al., 2003).;;
they reveal that increased belonging needs, and not differences in mood and self-esteem, were associated with an increased desire to listen to friends disclose emotional, but not descriptive, information.;;
for dulcinéia catadora, 'the encounters and exchanges between participants [from different strata of brazil's highly unequal society] is more important than the final product' insofar as they 'dismantle prejudices' and 'question aesthetic concepts connected to a world that's still being built on inequalities and privileges' (rosa, 2018).;;
"natural selection may favor developmental systems that use early-life experiences to calibrate later strategies, such that harsh or unpredictable early-life environments (e.g., resource-scarce or dangerous environments) sensitize individuals to follow faster strategies (belsky, schlomer, & ellis, 2012; ellis et al., 2009).";;
more important, proself people appeared to be more sensitive to the expected personal outcomes of privatization than did prosocial people (hypothesis 2b).;;
when dm1 and dm2 are completely independent, they are not faced with a pdg or even a social dilemma because there is no collective interest at stake: each dms choice affects only their own outcomes.;;
college students indicating higher levels of hope also reported higher levels of self-worth (snyder, hoza, pelham, & rapoff, 1997).;;
for researchers investigating violence and abuse, a necessary submission to periods of feeling like crap is required to enable the realities of living with the consequences to become more visible and relatable.;;
by conducting these adapted card sorts during on-site interviews, the researcher was able to observe non-verbal cues from patrons, as well as to ask follow-up questions for deeper reflection and elaboration.;;
we found that when par-ticipants were ostracized while possessing a temporary group membership, one that was not central to their identity, recovery from a needs threat was signifi cantly better than when participants were ostracized while possessing a permanent group membership.;;
having the backing of other key players in an organization is also vital to accessing research participants.;;
to increase the believability of the task, the participant's s.n.;;
collins (1985), for example, argues that unequal exchange between capital and labor reflects not only a structural asymmetry in the ability to exclude workers from access to the means of production, but also the structural constraints on the ability of workers to act collectively to protect themselves from exclusion.;;
research data infrastructure also pays attention to potential disclosure risks, and data repositories such as icpsr often offer secure dissemination services.;;
these authors also found that a facet of agreeableness from the five factor model (labeled straight forwardness exacerbated reactions to ostracism.;;
"in our investigations of reactive aggression using modified versions of the point subtraction aggression paradigm (psap, originally designed by cherek, 1981), reactive aggressive responses are made at a cost to earning financial reward (carré and mccormick, 2008; carré et al., 2009).";;
"postcritical ethnographers then must assume they exist within a critical discourse that in part makes them responsible for the world they are producing when they interpret and critique"" (noblit et al., 2004, p.24).";;
spector (2012) found that time requirements to fulfill job and research duties, financial costs of planning and conducting research, and communication and value disconnects between researchers and service providers all challenged the practical function of cbpr projects in service provision settings.;;
it has been repeatedly argued that subtle acts of aggression should always be included in the definition of bullying in order to fully grasp this phenomenon because the act of bullying is aimed at humiliating the victim and always has a psychological component (alsaker, 2004).;;
in other words, the effectiveness of the cooperative default on the contribution level is sensitive to the structure of the voluntary contribution game.;;
under the assumption that the dictator is selfish, the expected payoff of the receiver is around five points.;;
"finally, individuals experience a wide variety of negative outcomes when they are rejected or not included in groups, includinglower selfesteem, feelings of loss of control, life becoming less meaningful, lower belonging, less self-regulation and a drop in intelligent thought (see leary, 2010 for reviews; williams, 2009).";;
one way to address this problem is to use rotating coder teams (cascio et al., 2019), but this approach requires multiple rounds of new training sessions and may present difficulty in ensuring reliability across different coder teams.;;
across four studies, the same basic finding occurred: social exclusion led to physical insensitivity (numbing) to pain in comparison to the other conditions.;;
based on the definition of data reuse - the use of data collected by others and for purposes differing from the original intention - using videos of others' teaching activities rather than one's own would be considered to be the reuse of videos for teaching purposes.;;
since the differences between the bargaining powers of two players increase from the simultaneous to the sequential to the dictator game, comparisons among games allow us to trace whether the contribution behavior is motivated by fairness or is simply due to the strategic concern.;;
time pressure increases cooperation in competitively framed social dilemmas.;;
approaches from people wanting to talk about death and dying confounded the expectation of 'paper ethics' that these are taboo or sensitive subjects, and illuminated how the culture of the prison differed from what had been expected.;;
as a result, although researchers are coproducers of knowledge, intentions of highlighting the voices of research participants within this knowledge are prioritized.;;
in the condition where the confederate played tit-for-tat, pdg scores are not directly proportional to the number of times that participants chose to cooperate or compete.;;
in order to achieve an effective working relationship, ongoing support and guidance is essential, where all parties respect and value each other's knowledge, opinions and experiences whilst working towards answering a specific research question.;;
unlike other rejection paradigms (e.g., demarcated rejection or future life-alone), meta-analytic research has shown that ostracism paradigms (e.g., cyberball) have been shown to uniquely contribute to physiological arousal [gerber and wheeler, 2009] especially those with social evaluative threat and un control l ability [dickerson and kemeny, 2004].;;
my supervisor's guidance and expertise enabled me to see that i needed to gain a better balance between the informal and professional relationship and take more control over the recruitment to support the women and myself.;;
in absence of social support, excluded participants started to acutely seek and value money as a means to secure what they want out of the social system.;;
when subjects make their decisions in stage two in treatments d, a, and ad, subjects have observed the contribution decisions of all other members of the group, and therefore can condition their sanctioning and rewarding behaviors on this piece of information.;;
