to fully grasp the meta functionality of ot, we need a better understanding of how context matters, and what the effects of ot are when there are different sources of information competing for attention.;;
in order to give an incentive to take this decision seriously, those who actually make the right prediction gain an additional monetary payment.;;
the greater motivation to maximize the own group's outcome (relative and/or absolute) by actors with a salient social identity compared with the individual motivation to maximize the own personal outcome by actors with a salient personal identity was expected to mediate the behavioural difference in pdg-choices.;;
the slightly higher number of siblings in the high-mafia neighborhood likely biases against our results.;;
there is a bit of irony here: a method designed to minimize bias could conceivably introduce bias into a study.;;
the evaluation has increased trust in the quality of codings and this has created a sense of confidence to the researchers in establishing the code scheme for the qualitative study.;;
nonetheless, in neither study did the match or mismatch between participant sex and avatar sex interact with social inclusionary status to effect participants' mood and basic needs.;;
if, for example, the researcher had access to only a portion of the diaries in a multi-mode in-depth interview study, the final interpretations and conclusions reached by the researcher would be seriously in doubt.;;
this raises the issue of whether preferences would be stable against repeated measurement.;;
arguably, lack of explicit or active role of physiotherapists during care transition among older adults with hip fracture could be the reason for this significant omission (kalu, maximos, sengiad, & dal bello-haas, 2019).;;
the higher rate of interest among librarians in one particular method (phenomenology) is something that is worth further investigation.;;
concerning evidence from economic games, a metaanalysis of donation behavior in the dictator game found that older adults in western samples tend to donate 30% more than the average dictator (engel, 2011).;;
this research is based on self affirmation theory (steele, 1988), which holds that people are more accepting of threatening information when they can sustain a general feeling of morality, integrity, and consistency.;;
there is criticism that 'engagement' has trumped confrontation or challenge about men's use of violence, particularly when men are voluntarily, rather than court mandated, to attend.;;
this refers to consistency in how the same person codes data at multiple time points.;;
"by contrast, the ""real-time"" crisis impact research indicated that the shock to patterns of everyday life led to lasting, often adverse, adjustments to how people organized their work, family, food systems, social relationships, and to their well-being overall.";;
they found that, although both groups experienced the negative effects of ostracism, participants with high levels of social anxiety took longer to recover from the effects of ostracism than did non-anxious participants (see also oaten et al., 2008).;;
such leaders often dominate the participation process in a manner that directly benefits them, in particular when the flow of information is poor.;;
if these behavioral types are put in a dynamic context, they can generate 326 rationality and society 27(3) the well-known observation of decreasing cooperation levels in repeated public good situations.;;
cues of being watched enhance cooperation in a real-world setting.;;
although some people's self-esteem may vary from moment to moment others self-esteem may be uniquely conditional on specific areas that are important to them.;;
this generalisation is driven by the salient cues within the environment which are categorised and compared to previous situations.;;
institutions can encourage new norms with regard to these funds by providing information on how the average citizen behaves.;;
the sole exception was the in group ostracism condition, in which participants reported receiving the ball about as often (29%) as would be expected if they were equally included (33%), when in fact they only received the ball 20% of the time.;;
"hence, ""freezing"" the preregistration more than once could foster the transparency of qualitative research, as it allows the reviewer or interested reader to track the development of the study.";;
if the benefit of free riding is larger (smaller), then free riding (being law abiding) is the strictly dominant strategy.;;
shared across these variants, however, is an assumption that meaning can be phenom eno logically reduced from participants' expressed consciousness.;;
however, if an individual strongly identifies with a highly salient group, like a close clique of co-workers, he or she would likely experience higher gains of ee− if suddenly excluded from the group.;;
students who continued to use complex pavlovian strategies were less successful in the memory game, but more successful in the prisoner's dilemma, which indicates a trade-off in memory capacity for the two tasks.;;
furthermore, social and physical pain increased negative affect and produced higher desire to aggress than the control conditions.;;
both study 1 and study 2 showed that need satisfaction levels mediated mood and not vice versa when people were ostracized.;;
see also bartling and von siemens (2011), who find that wage inequality has no detrimental effect on effort provision in a team production setting.;;
this assertion has been supported by a series of laboratory studies showing that just 5-min of ostracism, either face-to-face or over the internet, reduced targets' feelings of belonging, control, self-esteem, and meaningful existence compared to subjects who were socially included (for review, see williams, 2001).;;
participants were led to believe that because this study was being conducted simultaneously by multiple departments at the university, they would be playing with other university students located throughout the campus.;;
downloaded by [gordon college] at 09:20 24 january 2014 24 the journal of social psychology the ostracism conditions also displayed a linear trend (f(1, 53) = 6.34, p = .02, η2 = 0.11), with needs being less threatened the more participants expected exclusion.;;
we further observe that the individual propensity to maximize couples' payoff depends on the size of the efficiency gain.;;
the results support the concept that the give-some situation is related to loss perception, whereas the take-some situation is independent of gain perception.;;
while the emphasis has been on the surprising behavior under simultaneous play, it is important to note that adherence to equilibrium also is sensitive to the fixed cost when contributions are made sequentially.;;
although many instances of ostracism are brief, it can be experienced for long durations.;;
ostracism by a computer is sufficient to lower self-reported levels of belonging, control, self-esteem, and meaningful existence.;;
global social knowledge has no effect on the aggregate level of cooperation.;;
"however, the use of ethnography seems to be limited in the field of entrepreneurship compared to other disciplines; this may be because ethnography is time intensive.";;
a separate independent variable and corresponding coefficient for value cannot be included in the model since individual values are unobserved and cost is constant across all respondents.;;
"and, ""the public is aware because water is always a conversation, but it seems like it's more of a conversation to be used as a scare tactic by antigrowth people than about people trying to make you just more aware of the resource"" (az 31-expert present).";;
if the group composition changes randomly in every period so that no subject meets any other subject more than once, a subject can never reap a selfish benefit from punishing defectors.;;
as there are different types and kinds of entrepreneurs, adopting re to study a specific group may require some modifications to be made to the technique without changing the underlying fundamental principles of ethnography.;;
in contrast, the group with largest investment after 14 we do not include the second proposals in the regression models because they were elicited during the game and therefore are likely to be endogenous.;;
conclusion the contribution of this paper lies in its demonstration, in a controlled environment, of how opacity in a simple investment setting can affect trust and trustworthiness and reduce the returns to the participants in the investment activity.;;
member checks can help researchers increase accuracy of their findings, reflect on their topic, and create change.;;
future training courses for qualitative data analysis by older adults should be co-designed by those they are intended to support, thus ensuring that course content and delivery are appropriate and fit for purpose.;;
results showed that participants were more likely to retaliate when given an unfair reason than a fair reason for not being selected.;;
"height and leadership"", the review of economic and statistics, vol.";;
it is important that the self affirmation manipulation had the intended effect among unrealistic optimists given that we had individuals self-affirm by discussing their positive health attributes.;;
"waldrop (2006) suggested that constructing ecomaps from previously transcribed interview data by a different researcher and correlating the findings with those of interview analysis resulted in ""observer triangulation"" and a method to improve trustworthiness of a study.";;
"there is growing evidence that the experience of being ostracized can impair individuals' abilities to self-regulate, leading to negative health behaviors, such as unhealthy eating (baumeister, dewall, ciarocco, & twenge, 2005; oaten, williams, jones, & zadro, 2008).";;
we believe the role of curation of qualitative data for reuse is to enable secondary users of data to act epistemically responsibly, that is, to allow them to learn additional evidence about the data they are reusing, which in turn allows them to shape justifiable beliefs based on those data.;;
clear majorities of students felt that the flow of online interviews was not the same as for face-to-face interviews, they could ask fewer follow-up questions than in face-to-face interviews, and they had more difficulty establishing rapport with their respondents.;;
as researchers involved with participatory research note, this local context can become a space in which the collaborative process can have the effect of resolving conflict and differences of power (bergold & thomas, 2012).;;
discussions about health and healthcare during the pandemic for both researchers and hcp participants allowed sensemaking and reflection that also bolstered feelings of resilience and coping, as reflected in conversations with participants, and researchers' own conversations with each other during and after research.;;
the basic model is that the employer issues travel vouchers to be used to pay for travel on public transport.;;
social adversity, if left unchanged, may increase the difficulty of promoting long-term changes in overweight youths' health behaviors.;;
if resources are below the maximum sustainable growth (for instance because of shocks), it would be beneficial for individuals to reduce their harvests so as to give the resource time to renew itself and reach the optimal level.;;
our conjecture is that groups have learned to distrust the other group during the face-to-face negotiations at each of the ten trials of the game.;;
"acquiring such permissions is easier to do during the initial informed consent process, so data producers need to be aware of this recommendation before they produce informed consent protocols (australian national data service, 2016; uk data archive, 2016).";;
thus, higher levels of fairness and cooperation are achieved by a lowering of the morals.;;
use of a lab setting gives a large amount of control over a study but has been accused of lacking realism (falk and heckman 2009).;;
first, the internal organization of web newsrooms (in particular the division of labor between editors and journalists) partly determines who is responsible for maximizing traffic.;;
such disclosure, however, risked distracting readers from the key findings.;;
thus, even 'true' pr involves participants having to accept researchers' paradigms of legitimate knowledge (how we know, what we know and how it should be represented), rather than the other way around.;;
doing qualitative research and making statements and recommendations about novel, 'morally interesting' phenomena therefore requires business ethics scholars to precisely describe their characterization of ethical conduct in a given situation, in addition to stating the rigor with which they conducted their study.;;
when the significant race and sex interaction is considered, the sex difference is evident only within the white subject group.;;
it is a major, shock-inducing injury that numbs rather than hurts.;;
this may be connected to the gap between intention and actual behaviour (kaiser et al., 2010).;;
the lack of significant moderation in this case does not necessarily mean that there is no influence of social anxiety on affect level over time, but this type of moderation may occur in a more extreme clinically anxious population.;;
this was intended to provide an opportunity for participants to deceive their partner about the reason for the outcome of the interview (i.e., to hide untrustworthy behavior by claiming the experimenter interview resulted in a correct guess).;;
however, today's negative events may influence perceptions of the past in different ways.;;
but on both sides of the debate surrounding how social service professions might respond to the technological capabilities of the digital age, professionals recognize the need to ensure that technological use is evidence-based, ethical, and in alignment with professional values and principles.;;
it therefore remains to be seen whether or not rejection the journal of social psychology 65 leads to similar increases in aggression when others are aware of the aggressive act.;;
researchers can feel traumatised after bearing witness to women's testimonies.;;
these findings supported the hypothesis that both individual and group factors would be associated with behavior in bullying situations.;;
it may be true that lack of incentive leads to lack of motivation, however, the availability of incentive does not guarantee that participants will have appropriate motivation or will behave as in real life (e.g.;;
people resist paying welfare to individuals who could support themselves but who instead cheat or free ride.;;
at an interpersonal level, repeated interviews generally made it possible to build genuine rapport with inter-viewees.;;
such biases can potentially cloud the decisions made during the search and may result in a misjudgement about a particular source.;;
elsewhere (stilwell et al., 2020), we describe how these types of clinical interactions involving enactive metaphor may be a powerful, yet overlooked learning mechanism that can shape patients' agency and affordances (i.e., their possibilities for action).;;
i sometimes find that collaborators want certainty (when there is none) when seeking answers to questions.;;
just stating the use of a digital tool does not guarantee transparency and credibility to the results of qualitative research.;;
ultimately, group membership may only act as a buffer against ostracism when it is not a central aspect of one's identity, and therefore escapable.;;
the heightened intensity of the context of an ice means that researchers have to be aware of the passive accumulation of contextual information so they can assess changing circumstances and manage the risks of their research location.;;
the jiegnote software generally yielded fewer transcription errors compared to the traditional methods, and on considering the effect size (hedge's g), the impact it had on the quality of transcript was small for the software was a working prototype at the time of the study.;;
given this reasoning, then all that matters is that participants perceive themselves to be ignored and excluded.;;
theoretically, one would expect this status information to affect primarily people who regard their group membership as important (h. j. smith & tyler, 1997).;;
games 2011, 2 445 6. conclusions in the experimental literature on pgg, repetition of the one-shot game has been shown to decrease contributions.;;
optimism was measured, as it seems likely that being optimistic would be associated with the view that one's life has meaning, whereas pessimism might be associated with the opposite view.;;
it has been shown that the inequity inherent in such social compensation can be highly demotivating, particularly when one is compensating for a lazy (rather than a low-ability) partner-we do not like ''playing the sucker'' and doing more than our fair share of the group's work (kerr, 1983).;;
in opinion groups, such as political parties or church groups, free riding is arguably a matter of less concern.;;
however, if the group fund fails to reach 2,000 (20,000) pennies, then all group members will fail to receive the bonus five dollars.;;
"it suggests that saturation is being used as a ""mantle of rigor"" (constantinou et al., 2017, p. 2) to provide the appearance of rigor that is largely unsubstantiated by re­ searchers and left unchallenged by reviewers of qualitative studies.";;
integrating qualitative and quantitative research methods progresses beyond the use of traditional quantitative methods and allows researchers to explore complex and intricate health dilemmas using innovative and more realistic and feasible approaches.;;
government will have 91 difficulty increasing social capital because it cannot replicate the effects of religion and cultural tradition.;;
rather than relying on a universal rule that dictates appropriate op e rationalization of qualitative methods to achieve high levels of quality and rigor, scholars often design qualitative projects with intensive focus on process (methods, technology, and tools) and the steps needed to achieve study goals.;;
thus, researchers are encouraged to explicitly state their inductive research question(s) to help orient readers into the aim of the study, even if the research question(s) naturally evolve (charmaz, 2006).;;
for example, verkuyten and yildiz (2007) found in a questionnaire study among turkish minority group members in the netherlands that they identified more with their religious ingroup when they perceived more rejection from the dominant outgroup.;;
also, pedestrians who were given an ''air-gaze'' (i.e., having someone look in their direction, but not giving them direct eye-contact) by a passerby felt decreased social connection (wesselmann, cardoso, slater, & williams, 2012).;;
"the pandemic has thus highlighted and magnified some of the ethical and practical tensions that emerge when conducting research with hcps; and the insights and implications from this period can be far-reaching, beyond the pandemic context.";;
ostracized participants also persisted for less time on the cognitive self-control task than their included peers.;;
this increases the suspicion that the group task was not strong enough to create group involvement.;;
due to limited time and inexperience of the peer researchers, the research team facilitated the grouping of information by supplying a list of predetermined themes to consider.;;
targets may have worked hard not because they cared about group performance but to get the money.;;
"an informal management style can help make up for the pressure effect on participants; another way to invite persons to express their opinions consists in asking ""pilot question"" in order to improve their self-esteem and make them independent during the discussion.";;
the psychological discomfort occurs even when being ostracized is accompanied by benefits such as monetary gain (van beest & williams, 2006).;;
capuchins also seem to exchange grooming for other commodities such as tolerance and food sharing (tiddi et al.;;
however, successful functioning also involves maintaining harmony in one's current relationships and in interactions that one may have with strangers and acquaintances when accomplishing personal goals.;;
lacking guidance, they often need to choose between moral imperatives in which the choice for one may result in the transgression of the other thereby creating an ethical dilemma.;;
in either case, ostracism and threat detection would cause both attention and effort to be simultaneously drawn toward social cues, especially for adolescents who are primed to think about their friend and away from the self-monitoring and self-regulatory processes needed for dietary restraint.;;
deprivation of social contact is stressful to both humans and animals.;;
interpretation requires a degree of unavoidable subjective intervention, which of course can also underlie quantitative data.;;
rather than a priori checks by a board on their research designs, which are often seen by researchers 'as something to get through, rather than a welcomed collegial process' (murray et al., 2012), most research seems to favour an ad hoc structure that may competently assess their work.;;
"relative to baseline, ostracized males reported more hostility than included males 20 min after the stressor; still, most of these levels of hostility were within the normal range of negative affect for most participants.";;
for example, maps created to identify areas of need in refugee camps can be repurposed to control the distribution of resources by those in power.;;
for example, in the extreme case of γ = 0, help is denied where without memory it would be given otherwise, if the combination of tags and strategy is prompting the agents to do so.;;
encountering the unfamiliar given my lack of medical experience, my time at the hospital was, and continues to be, filled with new experiences, some of which i found jarring.;;
whereas chronically abused children were more likely than their peers to avoid the school context, chronically excluded children were more likely to become disengaged from classroom activities.;;
the changing technological landscape makes it possible to digitally store data, creating opportunity to both share and reuse data anywhere in the world for later use.;;
second, we wish to present evidence relevant to the claim that communication about noise serves as an effective interpersonal means for reducing detrimental effects of noise.;;
if you are going to do the research and then hide it, it is your responsibility as an auto ethno graph er to reframe or rewrite it and use it as knowledge that can make a difference.;;
anonymity canada, interagency advisory panel on research ethics institutional permission to conduct research those conducting organizational research also need to be aware of the potential stigmatization or adverse outcomes related to the informed consent and privacy needs of individual participants.;;
this procedure affords a content-free manipulation of self-other similarity-one that (i) manipulates perceived similarity independent of group identity, and (ii) does not involve differences in incentives stemming from information exchange and reduced social distance.;;
"recent social psychological investigations seem to support this learning process: the experience of subtle manipulations of physical warmth (as compared to coldness) leads to the perception of another as more sociable (central to the person characteristic of ""warm"") and to greater prosocial behavior of the participant (williams & bargh, 2008).";;
pain res manage 2008 13 4 309 319 objective: to examine the hypothesis that experimental threats to social belongingness, interacting with individual differences in attachment security, cause modification of pain threshold reports by individuals who report high pain thresholds at baseline.;;
those with high baseline pain thresholds and low anxious attachment reported significantly lower post manipulation pain thresholds in the exclusion condition than in the inclusion condition.;;
"moreover, just as rejection leads to the adaptive response of increased sensitivity to affiliation cues (bernstein et al., 2008; gardner et al., 2000; maner et al., 2007; pickett et al., 2004), the effects of social acceptance on mating are also seemingly adaptive.";;
disrupting self-control recent research has found that self-regulation is impaired fairly easily.;;
defection out of fear (the prospect of being exploited by a defecting partner) is a case in point.;;
even if these tables never become part of the paper, reflecting on them may offer authors another opportunity to think through their interpretations before sending a paper out.;;
to be able to provide tailored emotional support that fits the experience of informal caregivers, identifying methodologies that can help provide a better understanding of the influential factors of decisionmaking is needed.;;
as in study 1, it seems that participants faced with the possibility of a loss were more reluctant to contribute, likely because of the perceived increased risk - even though the objective expected value of the public good never changed.;;
second, further studies can examine whether growth beliefs may lead to pro-social responses to ostracism.;;
furthermore, moving from the notion that extreme physical pain can lead to temporally analgesia of further physical pain (gear, aley, & levine, 1999), dewall and baumeister (2006) found that pre-living an extreme social pain condition (i.e., a life alone) resulted in emotional numbness (a form of analgesia).;;
