the deposits are therefore effectively fines imposed in response to noncompliance that would be repaid in the event that the violator returns to being in compliance.;;
"as noted earlier, many qualitatively oriented authors are critical of the way which ""protection"" is conceived within the medical framework of the belmont report, arguing that this in effect means that subjugated social groupings' perspectives can become excluded from being explored (martino & schormans, 2018; van den hoonaard, 2018).";;
"beyond rankings: using cognitive mapping to understand what health care journals represent"", social science & medicine, vol.";;
to enhance the credibility of providing other players' demographic information, and to increase the salience of group identities, participants first responded to measures of racial/ethnic identity, gender, and age, and were asked to provide their first names.;;
on the other hand, it is also possible that warm weather can compensate for feelings of coldness after rejection altogether.;;
neuroticism, low self-esteem) should exhibit greater distress following ostracism given that they tend to be more sensitive to social rejection.;;
it should also be noted that reported levels of religiosity correlated with cooperation rates in a similar manner for both black and white participants.;;
"similarly, the longer a person works in an organization, the more s/he understands the politics and interactions within the organization; hence, s/he will develop new explanations for events.";;
the curve for leader indicates that players in this game are more lilcely to pre-empt, presumably in order to gain the largest payoff' for themselves.;;
"this was done to bolster the believability of the bogus, randomly assigned ""future-lives"" feedback that they received next.";;
the observed levels of exiting, if translated into real group decisions, would have had implications for the autocratically led groups only.;;
these indicate significant group differences for cedo (expects cooperation and obtains defection) and cpdo (plays cooperatively and opponent defects).;;
in addition, delphi's online nature allowed us to reach out to a dispersed group of international 2 international journal of qualitative methods researchers and the pseudo an ony miz ed form precludes particular people from dominating the debate (graham et al., 2003).;;
while there are several substantive differences, we believe that the most salient is the decision variable that must be modified in order to cooperate.;;
however, these studies are all one-shot games with some combination of non-neutral language, a lack of financial incentives, a lack of additional controls, or substantial variations from the standard prisoner's dilemma (e.g., sequential moves, larger strategy space).;;
thus, when optimistically biased information preceded pessimistically biased information, the outcome desirability bias prevailed about how much to request or contribute.;;
the previous research documenting unmoderated effects of exclusion on individuals' basic needs levels relied on preference groups, such as computer, smoking, or political preferences, whose membership and effects may be more ephemeral.;;
they also allow aggregating different types of information and data, turning the research project easily portable, namely, in a hard disk or a computer.;;
by being in a poorer mood, people may not be able to experience this enhancement of enjoyment of engaging in a task that does occur when in a positive mood.;;
this less complete role adoption is revealed in the partial shift of expectation of the other's choice by cooperators who originally expected others to cooperate.;;
"denshire and lee (2013, 224) argue that ""putting the self into the picture at all is challenging enough in this context, but putting the very notion of a self at risk opens up places of vulnerability"".";;
in each of these examples, prosocial and ecologically motivated behavior is constrained by the presence of noise, and people get feedback that natural resources are in a bad state and in decline.;;
if so, then when people's need to belong (baumeister & leary, 1995) is threatened, they may be especially motivated to listen to emotional disclosure to fulfill this need.;;
"based on detailed occupational analyses, neo-weberians have developed class schema that allocate class positions according to their differences in labor market and work situations; these positions are consequential in terms of the distribution of life chances (breen, 2005).";;
the proportions of g1 and g4 depend on the initial conditions and on r. for lower r, the mild strategy g4 usually vanishes or remains at very low frequencies.;;
participation was restricted based on age as participants were at least 18 years of age in order to secure informed consent.;;
introduction experimental studies exploring endogenous group formation show that the degree of excludability of public goods or team goods (buchanan, 1965) is not the only factor that influences group contributions.;;
overall, this is consistent with the notion that older wom can be more assertive than older men.;;
even if everyone else agrees on a quantity and a distribution of cost shares, the failure of just 178 robert forsythe and r. mark isaac one agent to agree causes no public good to be provided.;;
pro-social individuals value group harmony and strive for the cooperative goal of reaching consensus and taking a highquality group decision.;;
such a study may not only contribute to our knowledge of equity on a group level, but may also increase our knowledge of why some leaders are supported and other leaders are rejected.;;
also, utilizing a pre-consent quiz, can help ensure that potential participants understand the research goals and procedures as well as their rights (simon and mosavel, 2011).;;
other factors may also induce a focus on other's outcomes.;;
disclosures that could harm employees in government, undermine national security, or put the general public at risk, are withheld under foi law and at the agency's discretion.;;
the findings demonstrate that disconnection influences the extent to which all parties in episodes of social exclusion are perceived in a dehumanized fashion.;;
we examined whether the social/physical pain overlap results in common psychological responses as well.;;
drawing on nm's research experiences with minority immigrant women, we see that reflecting on race, culture, and immigration are intrinsically linked to the interpretation of study findings.;;
see the terms and conditions https online library wiley com terms and conditions on wiley online library for rules of use; oa articles are governed by the applicable creative commons license also appeared to discount the ostracizing partner's better efforts and his/her suitability as a role model for the group.;
that is, one could say to one's self, ''to the extent that i send money to my partner i increase total possible payoffthreefold (from a maximum possible of $5 to a maximum possible of $15).;;
because social studies education departments were established in universities, and social studies drew the attention of researchers who not only study on social studies education but also study on other related fields such as curriculum and instruction in turkey.;;
it was possible that a social exchange situation may also activate other constructs which was examined in the pure trust condition.;;
prescriptively, once the quality of the various options is estimated with confidence whether based on a description of the possible outcomes of each choice and their probability of occurrence or gained through repeated experiences with the various options-the decision maker should consistently choose the option with the highest expected utility.;;
change in resource pool size in low and high discount rate groups.;;
if indeed punishment is associated with moral sentiments, then it may also be the case that the mere installation of a punishment evokes moral concerns (see also yanagida & fujii, 2004).;;
overall participation levels in larger compared to smaller groups (figure 5), while too small for statistical inference, suggest there may be benefits to smaller group sizes for participant engagement.;;
so it is once more confirmed that the collecting and analysis methods should be imposed by the research object, for this reason we define the fern (1982) position as weak because he prefers individual interviews rather than fg and in case of fg he selects mini-group instead of full-group.;;
"often each party would prefer to cooperate if the other party cooperates but not otherwise; efficient conflict resolution hinges, then, on whether the two negotiators can coordinate in cooperation (schelling, 1960).";;
ostracism was hypothesized to threaten targets' fundamental needs, including belonging, self-esteem, control, and meaningful existence.;;
while card sorting was initially developed for in-person research using physical cards, web-based tools now make it possible to conduct card-sort activities remotely (see box 1).;;
if total contributions equal or exceed the threshold t then each player receives an additional v units of the private good.;;
"these researchers explore improvements of quality of life of patients and self-efficacy through mobile devices, and highlight that compliance and acceptance is necessary to support the use of such technologies' (connelly et al., 2006; mattila, 2011).";;
perhaps as long as there are out-group members in the ostracizing group, targets of that ostracism are less likely to distort or disguise what actually happened.;;
there is also evidence that the relation between friendship features and social exclusion differs for boys and girls depending on the social context (underwood & buhrmester, 2007).;;
apart from that, complex coding systems can be organized into proper hierarchies and networks for users' quick reference, ultimately eases data presentation.;;
as expected, ostracism did not cause individuals to have significantly more negative ruminative cognitions that were specific to the ostracism episode.;;
this is because in academia citations play an important role in determining the reputation of the author as the expert in the field (aguinis et al.;;
alan a. benton analysis yielded a significant allocation effect (f=52.6, d} = 4/168, p < .01), which is apparent in the general tendency to rate allocations as less acceptable which provide self with a less preferred toy than that made available to other.;;
which is why, in the context of interpretation groups a different tone is adapted in comparison to discussions with a wider and more anonymous audience.;;
this new methodological approach seeks to help researchers collect data in a real-world setting while helping them validate the interpretation of their results.;;
however, at some point, an injury can become so severe that the body does not experience a heightened sense of pain but instead experiences a numbing.;;
thus, the accountability by design approach proposed here can be seen as an 'accountability mechanism' ( bovens, 2010 ), ensuring a greater level of accountability for individual researchers.;;
due to random encounters, this initial defection will spread at random throughout the economy.;;
the process of co-researching and co-reflection has deepened our relationship not just as researchers but also as friends, creating a safe place where we can be open and honest and support each other to think more creatively about our research.;;
"for example, being far from a loved one would certainly elicit social pain (as social distance is a trigger for social pain responses; see macdonald & leary, 2005).";;
the two key features in tests of the cognitive miser approach are that any player can veto the game after inspecting the payoff matrix and that the p and s payoffs constitute actual losses of money.;;
finally, contribution involves the way authors articulate and highlight the impact of their theorizing, in terms of whether it enables them to test, elaborate, or generate theory.;;
the overall conclusion drawn by these researchers was that social exclusion leads to a numbing of both the physicaland social-pain systems.;;
that is, ostracized participants reported feeling more ignored, more excluded, and that they had received fewer ball tosses than included participants (smallest f was for % throws received, f(1,52)d 92.32, p d<.001).;;
"such an argument is consistent with research in trait match distortion, which suggests that when people are forced to act against their trait preferences, they lose significant selfregulatory capacity (baumeister et al., 1998; deci, ryan, & williams, 1996).";;
in summary, the results of phase 2 show that although the signals did not gain control of behavior, they did promote preference for the cooperation key.;;
according to the senior and retired fishermen, the pooling arrangement had originally come about as a response to various economic conditions that the fishermen were facing in the 1960s.;;
apparently, the fact of having trusted the other and then having been exploited on the first encounter made the former set of subjects more negative toward the partner.;;
in two experiments, if a group of players share a history of playing the weak-link game efficiently, that efficiency precedent can transfer to a subsequent pd game, improving the level of cooperative ness;;
i wasnl about to let that happen, so that's why i usually took a little bit more than them.;;
given disruption is inevitable in global collaboration, strategies for shifting large coder team management online are crucial to have in place.;;
on the contrary, systemizers were predicted to report that they experienced less distress (self-reported satisfaction levels would not be impacted by exclusion) as a result of exclusion from the ball toss game.;;
in the face-to-face game, participants can get more cues from their group mates.;;
"if social exclusion does indeed lead consumers to want more money as a means to secure control in life, then it stands to reason that ""killing"" the belief that money can help secure such control should inhibit subsequent financial risk-taking.";;
"research that is culturally safe puts culture at the centre, is reflexive and reveals, understands and responds to power imbalances that may minimise, marginalise, subjugate or exclude the realities of research participants from culturally diverse backgrounds (baker et al., 2016; liamputtong, 2010; tillman, 2006).";;
the bright project sought to address these gaps with a goal of informing future intervention development to reduce health inequities in this marginalized population.;;
insiders comparing findings might also be under the impression that they are discussing the same phenomenon without realising that questions or concepts that seem self-evident might have an entirely different meaning in other settings.;;
for example, it has been shown to reduce the negative effects of stereotype threat on the math performance of female college students (steele, spencer, & aronson, 2002).;;
"dataone) might alleviate journals' difficulties navigating issues such as resource constriction for managing research outputs; the nuances of ownership rights and intellectual property; and principles of reuse, credit, and citation.";;
however, the maximum feasible group payoff would be attained only if each player contributed his full endowment to the group account.;;
by recording video data, researchers are able to shift analytic attention as processes unfold without sacrificing data collection (bailliard, 2015), which has proven especially helpful in live settings where various actions take place simultaneously (asan and montague, 2014).;;
in all treatments, a subject who played cooperate in the first round is more li following match than someone who was matched that behavior, although it could be the result of a is certainly consistent with updating behavior.;;
we also note that other methods of inducing social rejection may differ in terms of situational strength and thus researchers should continue to search for personality moderators of reactions to ostracism using different methods and large sample sizes.;;
and if the previous sanction indeed appears to have undermined trust in other people's internal motivation to cooperate, we may expect that to avect the level of cooperation in phase 2 as well.;;
such exploitation was not possible in our studies because the programmed other played tit for tat, but there are many strategies that are more lenient and can be exploited with some success.;;
perhaps the issue of control is less salient when we sit and watch the other players continue their exclusive interaction on the screen as compared with watching them in one's own presence.;;
together with the evidence presented in table 8.2, we can conclude that the effect of exclusion does not rely on a high frequency of exclusions.;;
such central groups may be perceived to afford great potential benefits when they accept us yet may pose greater perceived danger when they exclude us.;;
stressors arising in highly valued roles, meaning in life, and the physical health status of older adults.;;
in an authoritarian zone such as mcws, people know that speaking your mind can have negative consequences, and self-censorship has become second nature.;;
these two differences cause h1 to deviate from the minimal-group prediction.;;
"for example, ciarocco, sommer, and baumeister (2001) found decrements in self-control when participants were asked to ostracize another individual through giving them the ""silent treatment.""";;
the same could be the case for certain faculties within academic institutions that wish to ensure accountable research.;;
if people listen to increase their own feelings of social connection, then when their need to belong is threatened, they may be especially motivated to listen to their friends share emotional, but not necessarily descriptive, information.;;
challenges in the cross‐national and multi‐ language research despite the abovementioned advantages, cross‐national research raises some challenges, especially with qualitative methods.;;
they may pretend to be interested in certain stories not relevant to the research topic simply to stay friendly with the participant, or not confront the participant when they are lying, and so on (glasius et al.;;
since this was actually a joint task for half of the ss, it may have affected their level of cooperation in experiment ii, though quite a few ss never realized that they were working in a team.;;
finally, regarding ethics, al760 williams, cheung, and choi though internet research can provide written debriefing with handy links to the researchers' e-mail addresses, debriefing may be more effective if the researchers can see participants' faces and respond to their nonverbal behaviors (cooper, 1998).;;
research on in vivo rejection found that female cortisol levels were highest immediately after interpersonal rejection and although they continued to be higher throughout the rest of the postassessments than males, they did not increase after the immediate poststressor assessment [stroud et al., 2000, 2002].;;
social exclusion has been repeatedly shown to induce strong negative emotional reactions (for a review, see williams, 2007).;;
"for k = 1, the prediction is that ""i's"" will not spend but ""ni's"" will, when their costs are below the value of the public good.";;
de grada (2000) observes that numerosity can influence not only the tasks but also the internal group relationship.;;
yet, we find that previous wins (losses) dampen (amplify) current individual efforts, and thus relative group positions can alternate.;;
as a consequence, cooperation levels were vastly different: some participant pools invested almost all their endowment to the public good, whereas in others people invested less than a third.;;
"rather than intentionally malicious, these behaviors may reflect their alignment with stereotypical masculine norms of control and dominance over women (mac an gahaill et al., 2013; sallee and harris, 2011).";;
decisions about consent and confidentiality figure prominently in qualitative research because of the common focus on subjective views and experiences.;;
in general our findings suggest that being victimized may bias how subsequent exclusion situations are interpreted and being victimized may be associated with lower rates of recovery (because the devastating episodes are experienced repeatedly).;;
second, for these individuals, the evects of ostracism may be more persistent, that is, the evects of ostracism on their primary needs may continue over a longer period of time than those who are less sensitive or susceptible to the evects of ostracism.;;
in a very practical and technical sense, sharing qualitative data requires it being made available in a data repository of some sort, stored along with explanatory and contextual materials.;;
if that is correct, belongingness should have been related to increases in behavioral mimicry, but only when participants interacted with an in-group confederate.;;
in addition, the format of an interview can feel unnatural to friends or peers.;;
local interactions and anonymity proved to be frictions sufficient to put full cooperation out of reach.;;
however, there is a need for methodological flexibility in phenom eno logical research to open up opportunities to conduct clinically meaningful 2 international journal of qualitative methods research without having to follow overly complicated, confusing, and likely unnecessary procedures.;;
the results mirror the reality in which elites in a society are under higher pressure, since their choices deeply impact a society.;;
research suggests observing victims of various pains should invoke distress (cialdini et al., 1987), but theoretically only observing ostracism should influence participants' levels of need satisfaction (i.e., belonging, control, self-esteem, and meaningful existence) because these are the needs specifically thwarted by experiencing ostracism (williams, 2009).;;
the proposition that some kind of structure is present on which young children map their knowledge of social relations, is further buttressed by findings that securely attached children become more generous in physically warm conditions (versus cold), whereas insecurely attached children lack this effect (q.v.;;
further, ive paradigms designed to measure ostracism may allow researchers to test more nuanced hypotheses about the effects of ostracism.;;
in contrast, for novices individual feedback may be threatening as it can reveal their limited contributions.;;
because attractive exit options form a realistic threat to the group's existence, and thereby indirectly to the individual welfare, it is conceivable that mechanisms may have evolved in individuals to encourage them to forgo immediate outcomes available outside the group (nesse, 2001).;;
it may be that the children did not mean to disclose and did so by accident: young children have been found to make accidental disclosures more often than older children (ullman, 2002).;;
"people do contribute to charities even though they might each be better off by defecting to a pattern of non contribution and subjects in the laboratory when playing the prisoners' dilemma frequently chose to cooperate"" (ordeshook 1992, 176).";;
those with psychopathic features) may be less invested in social connection and therefore somewhat immune from the effects of ostracism.;;
non-affirmed unrealistic optimists expressed lower interest relative to controls, suggesting that they were responding defensively.;;
"de-skilling data analysis: the virtues of dancing in the dark"", international journal of research & method in education, vol.";;
previous laboratory research (williams & sommer, 1997) indicated that in a relatively short and seemingly innocuous face-to-face triadic balltoss interaction, participants who were not thrown the ball readily perceived being excluded and felt bad compared with participants who were included.;;
however, based on social impact theory (latané, 1981), one might actually predict that moving from an interindividual setting to an intergroup setting ought to moderate the immediate experience of ostracism.;;
"however, despite the rise of a number of critical and poststructural ways of knowing, it remains that most epistemological paradigms that engage qualitative research acknowledge ""that while knowledge is not objective, scientific validity is an ideal to strive toward"" (caretta & riano, 2016, p. 259, emphasis in original).";;
hence, the way water is governed largely influences whether the competition over scarce water resources results in conflict or cooperation.;;
closing the loop on data collection is critical and is achieved when thorough and valid analysis can be linked back to the conceptual framework, as addressed in the next section.;;
"members of stigmatized groups experience events they would attribute to prejudice frequently (hyers, 2007; swim, hyers, cohen, fitzgerald, & bylsma, 2003), underscoring greater experience with social rejection.";;
the sharing of qdas outputs has been blocked, partially, by the fact that most qdas are proprietary, and each different qdas application depends upon a unique data model (corti & gregory, 2011).;;
"what he tries to suggest to the children with whom he comes in contact in the school and beyond, is that ""you are part of this"" and that ""denying does not solve the crisis"".";;
explicitly identifying one's social position in qualitative research is a mechanism to make us aware of our own assumptions and biases, which is an important step toward improving the rigor and trustworthiness of our qualitative work (galdas, 2017).;;
